{
 "version": "block-2",
 "fps": 24,
 "lanes": [
  "head_straight",
  "head_hook",
  "head_uppercut",
  "body",
  "leg",
  "entry",
  "clinch",
  "single_support"
 ],
 "readiness_weights": {
  "base_readiness": 3.0,
  "guard_weight": 1.0,
  "method_weight": 1.0,
  "stance_weight": 0.85
 },
 "state_modifiers": {
  "recovery_window_penalty_scale": 1.0,
  "compromised_balance_penalty": -0.95,
  "off_base_balance_penalty": -1.65,
  "outside_angle_penalty": -1.1,
  "open_stance_rear_lane_penalty": -0.35,
  "wall_near_outfight_penalty": -1.25,
  "feint_attention_penalty": -1.1,
  "repeated_move_read_bonus": 0.85,
  "novel_move_surprise_penalty": -0.2,
  "fatigue_per_point_penalty": -0.1,
  "head_damage_reaction_penalty": -0.1,
  "body_damage_high_guard_drop": -0.14,
  "leg_damage_check_and_mobility_penalty": -0.2
 },
 "landing_multipliers": {
  "evaded": 0.0,
  "miss": 0.0,
  "caught": 0.08,
  "checked": 0.1,
  "jammed": 0.18,
  "blocked": 0.18,
  "partial": 0.5,
  "clean": 1.0,
  "counter_hit": 1.42,
  "flush": 1.55
 },
 "regional_damage_limits": {
  "head": 11.5,
  "body": 12.0,
  "leg": 12.5
 },
 "slot_depth_multipliers": {
  "1": 1.15,
  "2": 1.05,
  "3": 1.0,
  "4": 0.95
 },
 "diminishing_returns": {
  "posture_asymptote": 2.4,
  "readiness_compression": 0.62,
  "min_readiness": 1.45,
  "max_readiness": 4.85,
  "tempo_defensive_damping": 0.65
 },
 "tempo_rules": {
  "initiative_base": 3.0,
  "initiative_per_point": 0.3,
  "entry_per_point": 0.08,
  "low_tempo_readiness_per_point": 0.22,
  "low_tempo_counter_per_point": 0.05,
  "fatigue_by_tempo": {
   "1": 0.22,
   "2": 0.28,
   "3": 0.34,
   "4": 0.39,
   "5": 0.44
  }
 },
 "arena_presets": {
  "ring": {
   "id": "ring",
   "half_width_m": 3.0,
   "wall_near_m": 0.6,
   "has_walls": true,
   "has_corners": true,
   "corner_trap_bonus": 1.15,
   "lateral_freedom": 1.0
  },
  "cage": {
   "id": "cage",
   "half_width_m": 3.5,
   "wall_near_m": 0.65,
   "has_walls": true,
   "has_corners": false,
   "wall_pin_bonus": 1.2,
   "lateral_freedom": 1.1
  },
  "open_floor": {
   "id": "open_floor",
   "half_width_m": 50.0,
   "wall_near_m": 0.0,
   "has_walls": false,
   "has_corners": false,
   "lateral_freedom": 1.35
  },
  "narrow_alley": {
   "id": "narrow_alley",
   "half_width_m": 1.6,
   "wall_near_m": 0.5,
   "has_walls": true,
   "has_corners": true,
   "restricts_wide_kicks": true,
   "lateral_freedom": 0.55
  },
  "rooftop_edge": {
   "id": "rooftop_edge",
   "half_width_m": 2.8,
   "wall_near_m": 0.6,
   "has_walls": false,
   "has_drop_hazard": true,
   "lateral_freedom": 0.85
  },
  "dojo": {
   "id": "dojo",
   "half_width_m": 4.0,
   "wall_near_m": 0.6,
   "has_walls": true,
   "hard_floor_throw_bonus": 1.2,
   "lateral_freedom": 1.15
  }
 },
 "posture": {
  "guard_decay_rate_default": 0.06,
  "rear_heavy_to_front_heavy_leg_damage": 4.0,
  "head_position_high_fatigue": 5.0,
  "head_position_high_head_damage": 4.5,
  "guard_integrity_min": 0.25,
  "guard_decay_body_weight": 0.6,
  "guard_decay_fatigue_weight": 0.35,
  "vision_feint_penalty": 0.8,
  "vision_per_head_damage": 0.12
 },
 "readiness": {
  "clinch_guard_weight": 0.35,
  "clinch_tie_weight": 1.15,
  "null_tie_lane_default": -0.6,
  "underhook_bonus_per_hook": 0.35,
  "kick_range_head_seam_scale": 0.15,
  "offensive_seam_scale": 0.5,
  "mentality_positive_scale": 1.0,
  "mentality_negative_scale": 0.5,
  "recovery_non_exposed_fraction": 0.35,
  "feint_penalty": -0.55,
  "read_per_seen": 0.16,
  "read_per_consecutive": 0.24,
  "nonlane_readiness_default": 3.0,
  "nonlane_lane_map": {
   "ground": "clinch",
   "space": null,
   "note": "None = use nonlane_readiness_default (3.0). Reproduces legacy lanes for ride/armbar once technique data is read (P1b)."
  }
 },
 "kick_defense": {
  "catch_clamp": [
   0.1,
   0.65
  ],
  "catch_readiness_factor": 0.05,
  "kick_path_min_roll": 0.1,
  "kick_path_excluded": [
   "knee_body"
  ]
 },
 "damage": {
  "crouch_hook_bonus": 0.06,
  "switch_after_step_bonus": 0.08,
  "off_slot_penalty": -0.15,
  "fatigue_wear_per_point": -0.012,
  "leg_wear_kick_per_point": -0.03,
  "leg_wear_other_per_point": -0.015,
  "attacker_multiplier_clamp": [
   0.75,
   1.75
  ],
  "wall_landing_multiplier": 1.12,
  "guard_mitigation_intercept": 1.14,
  "guard_mitigation_per_coverage_point": 0.06,
  "block_absorb_blocked_landing": 0.24,
  "block_absorb_head_guard_factor": 0.9,
  "compounding_per_damage_point": 0.045,
  "compounding_damage_cap": 15.0,
  "defender_multiplier_min": 0.6,
  "check_recoil_fraction": 0.65,
  "tie_damage_fraction": 0.25,
  "tie_fatigue_fraction": 0.65,
  "submission_damage_fraction": 0.3,
  "submission_fatigue_fraction": 0.55,
  "stamina_drain_fatigue_fraction": 0.55
 },
 "simulation": {
  "start_x_positions": [
   -0.8,
   0.8
  ],
  "initiative_fatigue_drag": -0.08,
  "initiative_leg_drag": -0.1,
  "initiative_noise": 0.85,
  "clinch_exit_probability": 0.42,
  "entry_wall_distance_penalty": -0.65,
  "entry_leg_distance_penalty": -0.22,
  "entry_logistic_offset": 0.35,
  "entry_probability_clamp": [
   0.18,
   0.82
  ],
  "failed_entry_wall_drift_m": 0.28,
  "pull_out_probability_outfighter": 0.72,
  "pull_out_probability_default": 0.58,
  "pull_out_wall_penalty": -0.2,
  "feint_probability_cap": 0.55,
  "base_attack_skill": 3.3,
  "kick_range_punch_penalty": -0.85,
  "kick_range_shot_penalty": -0.75,
  "hit_probability_clamp": [
   0.1,
   0.85
  ],
  "flush_band_fraction": 0.28,
  "clean_band_fraction": 0.76,
  "counter_min_recovery_frames": 6,
  "counter_read_bonus_per_repeat": 0.07,
  "counter_read_repeats_cap": 3,
  "counter_recovery_bonus_per_frame_over_7": 0.06,
  "counter_guard_resist_per_point": 0.05,
  "counter_fatigue_penalty_per_point": 0.03,
  "counter_probability_clamp": [
   0.1,
   0.65
  ],
  "counter_hit_share": 0.62,
  "recovery_penalty_default": 0.4,
  "recovery_penalty_failed_multiplier": 1.25,
  "recovery_penalty_landed_multiplier": 0.6,
  "leg_compromise_threshold": 4.5,
  "pressure_wall_drift_m": 0.42,
  "outfighter_reset_factor": 0.55,
  "tempo_gap_frames": {
   "base": 36,
   "per_tempo_point": 4,
   "min": 6,
   "uses": "max(tempo_A, tempo_B)"
  },
  "recovery_drag": {
   "base": 1.45,
   "per_recovery_frame": 0.08,
   "failed_attack_extra": 0.65,
   "failed_outcomes": [
    "evaded",
    "blocked",
    "checked",
    "caught"
   ]
  },
  "caught_kick_sweep": {
   "base": 0.62,
   "clamp": [
    0.18,
    0.68
   ],
   "fatigue_per_point": 0.04,
   "scramble_if_resistance_gte": 0.12
  },
  "finish_thresholds": {
   "submission_stage": 3,
   "regional_limits_key": "regional_damage_limits"
  },
  "decision_weights": {
   "head": 1.15,
   "body": 1.05,
   "leg": 1.0,
   "control_mark": 1.5
  }
 },
 "legacy": {
  "move_stats": {
   "source": "engine/simulator_v2.py:38-75 (MOVE_BASE_STATS)",
   "table": {
    "step": {
     "base": 0.0,
     "type": "movement",
     "setup_f": 3,
     "exec_f": 6,
     "hold_f": 0,
     "rec_f": 4,
     "lane": "space"
    },
    "retreat": {
     "base": 0.0,
     "type": "movement",
     "setup_f": 2,
     "exec_f": 6,
     "hold_f": 0,
     "rec_f": 4,
     "lane": "space"
    },
    "pivot": {
     "base": 0.0,
     "type": "movement",
     "setup_f": 3,
     "exec_f": 7,
     "hold_f": 0,
     "rec_f": 4,
     "lane": "space"
    },
    "switch_step": {
     "base": 0.0,
     "type": "movement",
     "setup_f": 3,
     "exec_f": 8,
     "hold_f": 0,
     "rec_f": 5,
     "lane": "space"
    },
    "feint": {
     "base": 0.0,
     "type": "feint",
     "setup_f": 2,
     "exec_f": 5,
     "hold_f": 0,
     "rec_f": 3,
     "lane": "space"
    },
    "jab": {
     "base": 1.0,
     "type": "buildup",
     "setup_f": 3,
     "exec_f": 5,
     "hold_f": 2,
     "rec_f": 5,
     "lane": "head_straight"
    },
    "cross": {
     "base": 2.0,
     "type": "impact",
     "setup_f": 5,
     "exec_f": 7,
     "hold_f": 3,
     "rec_f": 8,
     "lane": "head_straight"
    },
    "hook": {
     "base": 2.5,
     "type": "impact",
     "setup_f": 5,
     "exec_f": 8,
     "hold_f": 3,
     "rec_f": 9,
     "lane": "head_hook"
    },
    "body_hook": {
     "base": 2.3,
     "type": "stamina_drain",
     "setup_f": 5,
     "exec_f": 8,
     "hold_f": 3,
     "rec_f": 8,
     "lane": "body"
    },
    "uppercut": {
     "base": 2.7,
     "type": "impact",
     "setup_f": 6,
     "exec_f": 8,
     "hold_f": 3,
     "rec_f": 10,
     "lane": "head_uppercut"
    },
    "haymaker": {
     "base": 3.2,
     "type": "impact",
     "setup_f": 9,
     "exec_f": 11,
     "hold_f": 4,
     "rec_f": 16,
     "lane": "head_hook"
    },
    "teep": {
     "base": 1.4,
     "type": "stamina_drain",
     "setup_f": 4,
     "exec_f": 7,
     "hold_f": 2,
     "rec_f": 7,
     "lane": "body"
    },
    "low_kick": {
     "base": 2.2,
     "type": "buildup",
     "setup_f": 5,
     "exec_f": 8,
     "hold_f": 3,
     "rec_f": 10,
     "lane": "leg"
    },
    "body_kick": {
     "base": 2.6,
     "type": "stamina_drain",
     "setup_f": 6,
     "exec_f": 9,
     "hold_f": 3,
     "rec_f": 12,
     "lane": "body"
    },
    "side_kick": {
     "base": 2.3,
     "type": "impact",
     "setup_f": 5,
     "exec_f": 8,
     "hold_f": 3,
     "rec_f": 10,
     "lane": "body"
    },
    "head_kick": {
     "base": 3.5,
     "type": "impact",
     "setup_f": 7,
     "exec_f": 10,
     "hold_f": 4,
     "rec_f": 15,
     "lane": "head_hook"
    },
    "switch_kick": {
     "base": 2.8,
     "type": "stamina_drain",
     "setup_f": 6,
     "exec_f": 9,
     "hold_f": 3,
     "rec_f": 11,
     "lane": "body"
    },
    "spinning_back_kick": {
     "base": 3.3,
     "type": "impact",
     "setup_f": 8,
     "exec_f": 10,
     "hold_f": 4,
     "rec_f": 16,
     "lane": "body",
     "vertical": "athletic"
    },
    "axe_kick": {
     "base": 3.1,
     "type": "impact",
     "setup_f": 8,
     "exec_f": 11,
     "hold_f": 3,
     "rec_f": 14,
     "lane": "head_straight",
     "vertical": "athletic"
    },
    "knee_body": {